<?xml version="1.0" encoding="UTF-8" ?>
<!--DTD-->
<!DOCTYPE vehiculos[
<!ELEMENT vehiculos (vehiculo+)>
<!ELEMENT vehiculo (destinatario,modelo,email,destino,identificador)>
<!ELEMENT destinatario (#PCDATA)>
<!ELEMENT modelo (#PCDATA)>
<!ELEMENT email (#PCDATA)>
<!ELEMENT destino (#PCDATA)>
<!ELEMENT identificador (#PCDATA)>
]>

<!--XML-->

<vehiculos>
	<vehiculo>
		<destinatario>Lysandra Gay</destinatario>
		<modelo>Chevrolet</modelo>
		<email>torquent.per@gmail.us</email>
		<destino>Ireland</destino>
		<identificador>749</identificador>
	</vehiculo>
	<vehiculo>
		<destinatario>Melvin Vance</destinatario>
		<modelo>Ferrari</modelo>
		<email>ut.tincidunt@hotmail.es</email>
		<destino>France</destino>
		<identificador>42057</identificador>
	</vehiculo>
	<vehiculo>
		<destinatario>Libby Randolph</destinatario>
		<modelo>Volkswagen</modelo>
		<email>felis.donec.tempor@hotmail.us</email>
		<destino>Vietnam</destino>
		<identificador>16354</identificador>
	</vehiculo>
	<vehiculo>
		<destinatario>Kimberley Wilkerson</destinatario>
		<modelo>Ford</modelo>
		<email>malesuada.fringilla.est@yahoo.com</email>
		<destino>Turkey</destino>
		<identificador>69509</identificador>
	</vehiculo>
	<vehiculo>
		<destinatario>Macon Meyers</destinatario>
		<modelo>BMW</modelo>
		<email>in.tempus.eu@protonmail.es</email>
		<destino>France</destino>
		<identificador>85751</identificador>
	</vehiculo>
	<vehiculo>
		<destinatario>Preston Booth</destinatario>
		<modelo>Porsche</modelo>
		<email>fames.ac@hotmail.com</email>
		<destino>New Zealand</destino>
		<identificador>50415</identificador>
	</vehiculo>
	<vehiculo>
		<destinatario>Damon Duffy</destinatario>
		<modelo>Peugeot</modelo>
		<email>semper@hotmail.es</email>
		<destino>France</destino>
		<identificador>72741</identificador>
	</vehiculo>
	<vehiculo>
		<destinatario>Cara Becker</destinatario>
		<modelo>Ferrari</modelo>
		<email>suspendisse.sed@outlook.es</email>
		<destino>Vietnam</destino>
		<identificador>14131</identificador>
	</vehiculo>
	<vehiculo>
		<destinatario>Chava Mendez</destinatario>
		<modelo>Ferrari</modelo>
		<email>nulla@yahoo.us</email>
		<destino>Belgium</destino>
		<identificador>92475</identificador>
	</vehiculo>
	<vehiculo>
		<destinatario>Wylie Jennings</destinatario>
		<modelo>Seat</modelo>
		<email>auctor.non@outlook.es</email>
		<destino>Indonesia</destino>
		<identificador>35529</identificador>
	</vehiculo>
	<vehiculo>
		<destinatario>Camilla Hensley</destinatario>
		<modelo>Citroën</modelo>
		<email>ac@outlook.es</email>
		<destino>Indonesia</destino>
		<identificador>67554</identificador>
	</vehiculo>
	<vehiculo>
		<destinatario>Alexander Randolph</destinatario>
		<modelo>Chevrolet</modelo>
		<email>tristique.aliquet@hotmail.us</email>
		<destino>Netherlands</destino>
		<identificador>14206</identificador>
	</vehiculo>
	<vehiculo>
		<destinatario>Latifah Brown</destinatario>
		<modelo>Mercedes-Benz</modelo>
		<email>commodo.at.libero@gmail.es</email>
		<destino>Canada</destino>
		<identificador>99152</identificador>
	</vehiculo>
	<vehiculo>
		<destinatario>Jeanette Mcguire</destinatario>
		<modelo>Lexus</modelo>
		<email>elementum.purus.accumsan@yahoo.com</email>
		<destino>France</destino>
		<identificador>59989</identificador>
	</vehiculo>
	<vehiculo>
		<destinatario>Quin Cole</destinatario>
		<modelo>Peugeot</modelo>
		<email>ut.semper@hotmail.us</email>
		<destino>Brazil</destino>
		<identificador>23335</identificador>
	</vehiculo>
	<vehiculo>
		<destinatario>Holly Anderson</destinatario>
		<modelo>Maruti Suzuki</modelo>
		<email>donec.est@hotmail.com</email>
		<destino>Spain</destino>
		<identificador>83068</identificador>
	</vehiculo>
	<vehiculo>
		<destinatario>Shannon Gill</destinatario>
		<modelo>Citroën</modelo>
		<email>sed@yahoo.us</email>
		<destino>China</destino>
		<identificador>7871</identificador>
	</vehiculo>
	<vehiculo>
		<destinatario>Demetrius Anthony</destinatario>
		<modelo>Volkswagen</modelo>
		<email>ante.dictum.cursus@yahoo.com</email>
		<destino>United States</destino>
		<identificador>59983</identificador>
	</vehiculo>
	<vehiculo>
		<destinatario>John Rosa</destinatario>
		<modelo>Citroën</modelo>
		<email>elit.pretium.et@yahoo.es</email>
		<destino>Italy</destino>
		<identificador>19612</identificador>
	</vehiculo>
	<vehiculo>
		<destinatario>Ciaran Gaines</destinatario>
		<modelo>Citroën</modelo>
		<email>vitae.dolor@protonmail.com</email>
		<destino>Poland</destino>
		<identificador>35306</identificador>
	</vehiculo>
	<vehiculo>
		<destinatario>Timon Williamson</destinatario>
		<modelo>Suzuki</modelo>
		<email>ac.feugiat.non@yahoo.es</email>
		<destino>Colombia</destino>
		<identificador>6060</identificador>
	</vehiculo>
	<vehiculo>
		<destinatario>Cedric Weber</destinatario>
		<modelo>Citroën</modelo>
		<email>cras.vulputate@gmail.com</email>
		<destino>Australia</destino>
		<identificador>72005</identificador>
	</vehiculo>
	<vehiculo>
		<destinatario>Ryan Alston</destinatario>
		<modelo>Volkswagen</modelo>
		<email>vehicula.et@protonmail.es</email>
		<destino>China</destino>
		<identificador>89508</identificador>
	</vehiculo>
	<vehiculo>
		<destinatario>Germaine Patton</destinatario>
		<modelo>Kia Motors</modelo>
		<email>lacus.mauris@hotmail.us</email>
		<destino>India</destino>
		<identificador>62798</identificador>
	</vehiculo>
	<vehiculo>
		<destinatario>Lewis Lynch</destinatario>
		<modelo>Toyota</modelo>
		<email>lacus.nulla@outlook.es</email>
		<destino>Russian Federation</destino>
		<identificador>55936</identificador>
	</vehiculo>
	<vehiculo>
		<destinatario>Gage Tucker</destinatario>
		<modelo>Honda</modelo>
		<email>tristique.senectus@hotmail.com</email>
		<destino>Austria</destino>
		<identificador>91987</identificador>
	</vehiculo>
	<vehiculo>
		<destinatario>Evangeline Sweeney</destinatario>
		<modelo>Peugeot</modelo>
		<email>aliquam.ultrices.iaculis@outlook.es</email>
		<destino>Australia</destino>
		<identificador>74370</identificador>
	</vehiculo>
	<vehiculo>
		<destinatario>Patricia Bullock</destinatario>
		<modelo>Citroën</modelo>
		<email>semper.et.lacinia@yahoo.es</email>
		<destino>Peru</destino>
		<identificador>54626</identificador>
	</vehiculo>
	<vehiculo>
		<destinatario>Talon Walker</destinatario>
		<modelo>Audi</modelo>
		<email>diam@hotmail.com</email>
		<destino>Mexico</destino>
		<identificador>98371</identificador>
	</vehiculo>
	<vehiculo>
		<destinatario>Aurelia Ayala</destinatario>
		<modelo>Mazda</modelo>
		<email>hendrerit.donec.porttitor@outlook.us</email>
		<destino>United Kingdom</destino>
		<identificador>53253</identificador>
	</vehiculo>
	<vehiculo>
		<destinatario>Cole Barton</destinatario>
		<modelo>Chevrolet</modelo>
		<email>penatibus.et@hotmail.es</email>
		<destino>Italy</destino>
		<identificador>97917</identificador>
	</vehiculo>
	<vehiculo>
		<destinatario>Jacob Mccall</destinatario>
		<modelo>Infiniti</modelo>
		<email>hendrerit@hotmail.us</email>
		<destino>China</destino>
		<identificador>32037</identificador>
	</vehiculo>
	<vehiculo>
		<destinatario>Tyrone Mcfadden</destinatario>
		<modelo>MINI</modelo>
		<email>leo.vivamus.nibh@outlook.es</email>
		<destino>Pakistan</destino>
		<identificador>16384</identificador>
	</vehiculo>
	<vehiculo>
		<destinatario>Michael Atkinson</destinatario>
		<modelo>Nissan</modelo>
		<email>nulla@outlook.us</email>
		<destino>Belgium</destino>
		<identificador>1832</identificador>
	</vehiculo>
	<vehiculo>
		<destinatario>Malik Woods</destinatario>
		<modelo>Kia Motors</modelo>
		<email>at@outlook.com</email>
		<destino>Brazil</destino>
		<identificador>23611</identificador>
	</vehiculo>
	<vehiculo>
		<destinatario>Lareina Coffey</destinatario>
		<modelo>Chevrolet</modelo>
		<email>fringilla.cursus@gmail.com</email>
		<destino>Ireland</destino>
		<identificador>73878</identificador>
	</vehiculo>
	<vehiculo>
		<destinatario>Tate Barrera</destinatario>
		<modelo>Subaru</modelo>
		<email>cursus@gmail.com</email>
		<destino>India</destino>
		<identificador>75291</identificador>
	</vehiculo>
	<vehiculo>
		<destinatario>Orli Emerson</destinatario>
		<modelo>Subaru</modelo>
		<email>sociis.natoque@yahoo.com</email>
		<destino>United States</destino>
		<identificador>13529</identificador>
	</vehiculo>
	<vehiculo>
		<destinatario>Nayda Knight</destinatario>
		<modelo>Hyundai Motors</modelo>
		<email>eget.venenatis@yahoo.es</email>
		<destino>Colombia</destino>
		<identificador>70123</identificador>
	</vehiculo>
	<vehiculo>
		<destinatario>Nichole Rivas</destinatario>
		<modelo>Mazda</modelo>
		<email>in.tincidunt@protonmail.es</email>
		<destino>Spain</destino>
		<identificador>48796</identificador>
	</vehiculo>
	<vehiculo>
		<destinatario>Erin Mcneil</destinatario>
		<modelo>Mazda</modelo>
		<email>et.eros@yahoo.com</email>
		<destino>Australia</destino>
		<identificador>54555</identificador>
	</vehiculo>
	<vehiculo>
		<destinatario>Graiden Whitehead</destinatario>
		<modelo>BMW</modelo>
		<email>nisi.dictum@yahoo.com</email>
		<destino>South Korea</destino>
		<identificador>24252</identificador>
	</vehiculo>
	<vehiculo>
		<destinatario>Melodie Kane</destinatario>
		<modelo>Skoda</modelo>
		<email>congue.elit.sed@gmail.es</email>
		<destino>New Zealand</destino>
		<identificador>9276</identificador>
	</vehiculo>
	<vehiculo>
		<destinatario>Larissa Fields</destinatario>
		<modelo>Mitsubishi Motors</modelo>
		<email>in.at@protonmail.us</email>
		<destino>Russian Federation</destino>
		<identificador>8402</identificador>
	</vehiculo>
	<vehiculo>
		<destinatario>Damon Burke</destinatario>
		<modelo>Seat</modelo>
		<email>sed@outlook.us</email>
		<destino>China</destino>
		<identificador>88638</identificador>
	</vehiculo>
	<vehiculo>
		<destinatario>Cailin Walker</destinatario>
		<modelo>Subaru</modelo>
		<email>tincidunt.vehicula.risus@hotmail.com</email>
		<destino>Canada</destino>
		<identificador>88942</identificador>
	</vehiculo>
	<vehiculo>
		<destinatario>Brooke Pratt</destinatario>
		<modelo>MINI</modelo>
		<email>ante.iaculis.nec@hotmail.com</email>
		<destino>Netherlands</destino>
		<identificador>21768</identificador>
	</vehiculo>
	<vehiculo>
		<destinatario>Octavia Santos</destinatario>
		<modelo>Peugeot</modelo>
		<email>ipsum.dolor.sit@gmail.com</email>
		<destino>Norway</destino>
		<identificador>86943</identificador>
	</vehiculo>
	<vehiculo>
		<destinatario>Wade Maldonado</destinatario>
		<modelo>Peugeot</modelo>
		<email>condimentum.donec.at@hotmail.com</email>
		<destino>China</destino>
		<identificador>62489</identificador>
	</vehiculo>
	<vehiculo>
		<destinatario>Hollee Pope</destinatario>
		<modelo>Chevrolet</modelo>
		<email>etiam.laoreet@gmail.com</email>
		<destino>France</destino>
		<identificador>85252</identificador>
	</vehiculo>
	<vehiculo>
		<destinatario>Robin Fowler</destinatario>
		<modelo>Dodge</modelo>
		<email>facilisis.lorem@gmail.es</email>
		<destino>Pakistan</destino>
		<identificador>10807</identificador>
	</vehiculo>
	<vehiculo>
		<destinatario>Zeus Dillard</destinatario>
		<modelo>Audi</modelo>
		<email>elit.erat.vitae@protonmail.es</email>
		<destino>Colombia</destino>
		<identificador>71923</identificador>
	</vehiculo>
	<vehiculo>
		<destinatario>Halla Harding</destinatario>
		<modelo>BMW</modelo>
		<email>ante.dictum.mi@outlook.com</email>
		<destino>Sweden</destino>
		<identificador>45912</identificador>
	</vehiculo>
	<vehiculo>
		<destinatario>Flynn Saunders</destinatario>
		<modelo>Citroën</modelo>
		<email>velit@hotmail.us</email>
		<destino>Costa Rica</destino>
		<identificador>68794</identificador>
	</vehiculo>
	<vehiculo>
		<destinatario>Martena Norman</destinatario>
		<modelo>Chevrolet</modelo>
		<email>at.risus@outlook.us</email>
		<destino>Belgium</destino>
		<identificador>12921</identificador>
	</vehiculo>
	<vehiculo>
		<destinatario>Charity Valencia</destinatario>
		<modelo>Mercedes-Benz</modelo>
		<email>habitant.morbi.tristique@outlook.us</email>
		<destino>India</destino>
		<identificador>54604</identificador>
	</vehiculo>
	<vehiculo>
		<destinatario>Chava Hogan</destinatario>
		<modelo>Porsche</modelo>
		<email>mollis.nec.cursus@gmail.es</email>
		<destino>Ireland</destino>
		<identificador>29684</identificador>
	</vehiculo>
	<vehiculo>
		<destinatario>Driscoll Mccall</destinatario>
		<modelo>Subaru</modelo>
		<email>purus.nullam@gmail.us</email>
		<destino>Russian Federation</destino>
		<identificador>6102</identificador>
	</vehiculo>
	<vehiculo>
		<destinatario>Quamar Aguirre</destinatario>
		<modelo>Dodge</modelo>
		<email>imperdiet@yahoo.com</email>
		<destino>Canada</destino>
		<identificador>18188</identificador>
	</vehiculo>
	<vehiculo>
		<destinatario>Hilel Pollard</destinatario>
		<modelo>Lexus</modelo>
		<email>vel.quam@gmail.us</email>
		<destino>New Zealand</destino>
		<identificador>61579</identificador>
	</vehiculo>
	<vehiculo>
		<destinatario>Cherokee Callahan</destinatario>
		<modelo>Mazda</modelo>
		<email>praesent.interdum@hotmail.us</email>
		<destino>China</destino>
		<identificador>93583</identificador>
	</vehiculo>
	<vehiculo>
		<destinatario>Felix Lyons</destinatario>
		<modelo>Subaru</modelo>
		<email>libero.est@yahoo.com</email>
		<destino>China</destino>
		<identificador>33561</identificador>
	</vehiculo>
	<vehiculo>
		<destinatario>Caleb Britt</destinatario>
		<modelo>Volkswagen</modelo>
		<email>proin.eget@protonmail.es</email>
		<destino>Poland</destino>
		<identificador>79070</identificador>
	</vehiculo>
	<vehiculo>
		<destinatario>Kieran Bass</destinatario>
		<modelo>Hyundai Motors</modelo>
		<email>orci@outlook.com</email>
		<destino>Vietnam</destino>
		<identificador>12558</identificador>
	</vehiculo>
	<vehiculo>
		<destinatario>Adara Dunlap</destinatario>
		<modelo>Porsche</modelo>
		<email>praesent@gmail.com</email>
		<destino>United Kingdom</destino>
		<identificador>91713</identificador>
	</vehiculo>
	<vehiculo>
		<destinatario>Lenore Carver</destinatario>
		<modelo>Citroën</modelo>
		<email>aenean.massa@gmail.es</email>
		<destino>Pakistan</destino>
		<identificador>51248</identificador>
	</vehiculo>
	<vehiculo>
		<destinatario>Bo Wynn</destinatario>
		<modelo>Seat</modelo>
		<email>sit.amet@outlook.es</email>
		<destino>South Korea</destino>
		<identificador>94797</identificador>
	</vehiculo>
	<vehiculo>
		<destinatario>Brady Battle</destinatario>
		<modelo>Volkswagen</modelo>
		<email>amet.ornare.lectus@hotmail.us</email>
		<destino>Nigeria</destino>
		<identificador>48567</identificador>
	</vehiculo>
	<vehiculo>
		<destinatario>Zeus Harris</destinatario>
		<modelo>Volvo</modelo>
		<email>fringilla.mi.lacinia@protonmail.us</email>
		<destino>Pakistan</destino>
		<identificador>94127</identificador>
	</vehiculo>
	<vehiculo>
		<destinatario>Jameson Harrison</destinatario>
		<modelo>Dodge</modelo>
		<email>diam.sed@protonmail.com</email>
		<destino>Spain</destino>
		<identificador>54596</identificador>
	</vehiculo>
	<vehiculo>
		<destinatario>Kristen O'connor</destinatario>
		<modelo>BMW</modelo>
		<email>mollis.nec@hotmail.com</email>
		<destino>Nigeria</destino>
		<identificador>74654</identificador>
	</vehiculo>
	<vehiculo>
		<destinatario>Leandra Horn</destinatario>
		<modelo>Toyota</modelo>
		<email>nec.mollis@yahoo.us</email>
		<destino>Chile</destino>
		<identificador>12974</identificador>
	</vehiculo>
	<vehiculo>
		<destinatario>Jack Knowles</destinatario>
		<modelo>Ford</modelo>
		<email>nonummy.ipsum@gmail.com</email>
		<destino>Germany</destino>
		<identificador>46084</identificador>
	</vehiculo>
	<vehiculo>
		<destinatario>Garrison Henson</destinatario>
		<modelo>Skoda</modelo>
		<email>nisi@gmail.es</email>
		<destino>Belgium</destino>
		<identificador>99722</identificador>
	</vehiculo>
	<vehiculo>
		<destinatario>Francesca Salazar</destinatario>
		<modelo>Maruti Suzuki</modelo>
		<email>malesuada.integer@hotmail.es</email>
		<destino>United Kingdom</destino>
		<identificador>82275</identificador>
	</vehiculo>
	<vehiculo>
		<destinatario>August Bolton</destinatario>
		<modelo>Audi</modelo>
		<email>iaculis@outlook.us</email>
		<destino>Belgium</destino>
		<identificador>81584</identificador>
	</vehiculo>
	<vehiculo>
		<destinatario>Oliver Moreno</destinatario>
		<modelo>Ferrari</modelo>
		<email>ipsum.nunc@gmail.us</email>
		<destino>Norway</destino>
		<identificador>32335</identificador>
	</vehiculo>
	<vehiculo>
		<destinatario>Elaine Haynes</destinatario>
		<modelo>Nissan</modelo>
		<email>mi.pede.nonummy@hotmail.com</email>
		<destino>Pakistan</destino>
		<identificador>84145</identificador>
	</vehiculo>
	<vehiculo>
		<destinatario>Denise Fitzgerald</destinatario>
		<modelo>Mercedes-Benz</modelo>
		<email>orci.sem.eget@protonmail.com</email>
		<destino>South Korea</destino>
		<identificador>19665</identificador>
	</vehiculo>
	<vehiculo>
		<destinatario>Gannon Carlson</destinatario>
		<modelo>Dodge</modelo>
		<email>sed.eu.eros@protonmail.com</email>
		<destino>United Kingdom</destino>
		<identificador>17922</identificador>
	</vehiculo>
	<vehiculo>
		<destinatario>Katell Burch</destinatario>
		<modelo>Porsche</modelo>
		<email>tellus.sem.mollis@gmail.es</email>
		<destino>Sweden</destino>
		<identificador>76695</identificador>
	</vehiculo>
	<vehiculo>
		<destinatario>Calista Lopez</destinatario>
		<modelo>Peugeot</modelo>
		<email>egestas.ligula@hotmail.es</email>
		<destino>Vietnam</destino>
		<identificador>30732</identificador>
	</vehiculo>
	<vehiculo>
		<destinatario>Hiroko Haney</destinatario>
		<modelo>MINI</modelo>
		<email>sapien@protonmail.es</email>
		<destino>South Korea</destino>
		<identificador>82907</identificador>
	</vehiculo>
	<vehiculo>
		<destinatario>Fay Mccullough</destinatario>
		<modelo>Subaru</modelo>
		<email>at@gmail.es</email>
		<destino>Chile</destino>
		<identificador>94291</identificador>
	</vehiculo>
	<vehiculo>
		<destinatario>Larissa Mcpherson</destinatario>
		<modelo>Ferrari</modelo>
		<email>feugiat.sed@yahoo.com</email>
		<destino>Belgium</destino>
		<identificador>71803</identificador>
	</vehiculo>
	<vehiculo>
		<destinatario>Hoyt Goodman</destinatario>
		<modelo>Kia Motors</modelo>
		<email>risus.nunc@protonmail.es</email>
		<destino>Costa Rica</destino>
		<identificador>7269</identificador>
	</vehiculo>
	<vehiculo>
		<destinatario>Jonas Padilla</destinatario>
		<modelo>Infiniti</modelo>
		<email>magna.nec@yahoo.com</email>
		<destino>Indonesia</destino>
		<identificador>70520</identificador>
	</vehiculo>
	<vehiculo>
		<destinatario>Barclay Salinas</destinatario>
		<modelo>Cadillac</modelo>
		<email>nunc@gmail.es</email>
		<destino>Italy</destino>
		<identificador>35779</identificador>
	</vehiculo>
	<vehiculo>
		<destinatario>Brooke Cervantes</destinatario>
		<modelo>Mercedes-Benz</modelo>
		<email>ligula.nullam.enim@yahoo.us</email>
		<destino>Colombia</destino>
		<identificador>4868</identificador>
	</vehiculo>
	<vehiculo>
		<destinatario>Sharon Bishop</destinatario>
		<modelo>Suzuki</modelo>
		<email>volutpat.nunc@hotmail.com</email>
		<destino>Russian Federation</destino>
		<identificador>49439</identificador>
	</vehiculo>
	<vehiculo>
		<destinatario>Reece Navarro</destinatario>
		<modelo>Cadillac</modelo>
		<email>egestas.a@hotmail.com</email>
		<destino>Poland</destino>
		<identificador>4036</identificador>
	</vehiculo>
	<vehiculo>
		<destinatario>Hakeem Sloan</destinatario>
		<modelo>Seat</modelo>
		<email>adipiscing.lobortis@protonmail.es</email>
		<destino>Spain</destino>
		<identificador>14140</identificador>
	</vehiculo>
	<vehiculo>
		<destinatario>Ariel Berry</destinatario>
		<modelo>Volkswagen</modelo>
		<email>facilisis.facilisis.magna@outlook.es</email>
		<destino>Australia</destino>
		<identificador>79127</identificador>
	</vehiculo>
	<vehiculo>
		<destinatario>Cullen Walters</destinatario>
		<modelo>Mazda</modelo>
		<email>ut.nulla@yahoo.us</email>
		<destino>Indonesia</destino>
		<identificador>86726</identificador>
	</vehiculo>
	<vehiculo>
		<destinatario>Hiram Cooper</destinatario>
		<modelo>Nissan</modelo>
		<email>libero.proin.mi@hotmail.es</email>
		<destino>Russian Federation</destino>
		<identificador>67535</identificador>
	</vehiculo>
	<vehiculo>
		<destinatario>Geoffrey Herring</destinatario>
		<modelo>Chevrolet</modelo>
		<email>lorem.ut.aliquam@outlook.com</email>
		<destino>Pakistan</destino>
		<identificador>71370</identificador>
	</vehiculo>
	<vehiculo>
		<destinatario>Arden Case</destinatario>
		<modelo>Mitsubishi Motors</modelo>
		<email>proin.vel.nisl@outlook.us</email>
		<destino>Ireland</destino>
		<identificador>45630</identificador>
	</vehiculo>
	<vehiculo>
		<destinatario>Channing Thomas</destinatario>
		<modelo>BMW</modelo>
		<email>orci@protonmail.es</email>
		<destino>New Zealand</destino>
		<identificador>74048</identificador>
	</vehiculo>
	<vehiculo>
		<destinatario>Jamal O'Neill</destinatario>
		<modelo>Kia Motors</modelo>
		<email>mollis.duis@protonmail.com</email>
		<destino>Mexico</destino>
		<identificador>94518</identificador>
	</vehiculo>
	<vehiculo>
		<destinatario>Channing Levy</destinatario>
		<modelo>Ford</modelo>
		<email>taciti.sociosqu@protonmail.us</email>
		<destino>Costa Rica</destino>
		<identificador>47014</identificador>
	</vehiculo>
	<vehiculo>
		<destinatario>Jade Pearson</destinatario>
		<modelo>Volvo</modelo>
		<email>cursus.luctus@protonmail.es</email>
		<destino>Costa Rica</destino>
		<identificador>21211</identificador>
	</vehiculo>
	<vehiculo>
		<destinatario>Chase Fisher</destinatario>
		<modelo>Nissan</modelo>
		<email>fringilla.donec@protonmail.es</email>
		<destino>Costa Rica</destino>
		<identificador>77416</identificador>
	</vehiculo>
	<vehiculo>
		<destinatario>Leah Sampson</destinatario>
		<modelo>Cadillac</modelo>
		<email>tristique.ac@protonmail.com</email>
		<destino>France</destino>
		<identificador>37362</identificador>
	</vehiculo>
	<vehiculo>
		<destinatario>Ray Sims</destinatario>
		<modelo>Mitsubishi Motors</modelo>
		<email>vivamus.nisi@protonmail.es</email>
		<destino>Russian Federation</destino>
		<identificador>62024</identificador>
	</vehiculo>
	<vehiculo>
		<destinatario>Salvador Morse</destinatario>
		<modelo>Renault</modelo>
		<email>arcu.imperdiet@hotmail.us</email>
		<destino>United Kingdom</destino>
		<identificador>10420</identificador>
	</vehiculo>
	<vehiculo>
		<destinatario>Lani Robbins</destinatario>
		<modelo>MINI</modelo>
		<email>mi.pede@hotmail.us</email>
		<destino>Sweden</destino>
		<identificador>79240</identificador>
	</vehiculo>
	<vehiculo>
		<destinatario>Mufutau Grimes</destinatario>
		<modelo>Lexus</modelo>
		<email>suscipit.est@outlook.com</email>
		<destino>Canada</destino>
		<identificador>76468</identificador>
	</vehiculo>
	<vehiculo>
		<destinatario>Troy Cervantes</destinatario>
		<modelo>Mazda</modelo>
		<email>mauris.ipsum.porta@yahoo.us</email>
		<destino>Mexico</destino>
		<identificador>80951</identificador>
	</vehiculo>
	<vehiculo>
		<destinatario>Burke Kidd</destinatario>
		<modelo>Dacia</modelo>
		<email>nam.tempor.diam@protonmail.com</email>
		<destino>Netherlands</destino>
		<identificador>40859</identificador>
	</vehiculo>
	<vehiculo>
		<destinatario>Akeem Booth</destinatario>
		<modelo>BMW</modelo>
		<email>non.egestas.a@protonmail.com</email>
		<destino>Pakistan</destino>
		<identificador>56875</identificador>
	</vehiculo>
	<vehiculo>
		<destinatario>Stephen Sims</destinatario>
		<modelo>Peugeot</modelo>
		<email>donec@gmail.com</email>
		<destino>Austria</destino>
		<identificador>88823</identificador>
	</vehiculo>
	<vehiculo>
		<destinatario>Austin Hobbs</destinatario>
		<modelo>Peugeot</modelo>
		<email>bibendum@yahoo.es</email>
		<destino>France</destino>
		<identificador>17910</identificador>
	</vehiculo>
	<vehiculo>
		<destinatario>Declan Hawkins</destinatario>
		<modelo>Subaru</modelo>
		<email>bibendum.sed@yahoo.com</email>
		<destino>Colombia</destino>
		<identificador>65836</identificador>
	</vehiculo>
	<vehiculo>
		<destinatario>Slade Mercer</destinatario>
		<modelo>Nissan</modelo>
		<email>blandit.enim@protonmail.com</email>
		<destino>New Zealand</destino>
		<identificador>72949</identificador>
	</vehiculo>
	<vehiculo>
		<destinatario>Chaim Whitley</destinatario>
		<modelo>Infiniti</modelo>
		<email>fusce.aliquam@outlook.es</email>
		<destino>United Kingdom</destino>
		<identificador>11585</identificador>
	</vehiculo>
	<vehiculo>
		<destinatario>Adele Lambert</destinatario>
		<modelo>Lexus</modelo>
		<email>blandit.at@outlook.us</email>
		<destino>Australia</destino>
		<identificador>23661</identificador>
	</vehiculo>
	<vehiculo>
		<destinatario>Shelley Matthews</destinatario>
		<modelo>Dodge</modelo>
		<email>ullamcorper.velit@hotmail.com</email>
		<destino>Indonesia</destino>
		<identificador>51737</identificador>
	</vehiculo>
	<vehiculo>
		<destinatario>Carly Townsend</destinatario>
		<modelo>Maruti Suzuki</modelo>
		<email>sit.amet@outlook.com</email>
		<destino>Sweden</destino>
		<identificador>89103</identificador>
	</vehiculo>
	<vehiculo>
		<destinatario>Zelda Mullins</destinatario>
		<modelo>Lexus</modelo>
		<email>lorem.semper@protonmail.us</email>
		<destino>Chile</destino>
		<identificador>48258</identificador>
	</vehiculo>
	<vehiculo>
		<destinatario>Jonah Goff</destinatario>
		<modelo>BMW</modelo>
		<email>semper.cursus@protonmail.es</email>
		<destino>Turkey</destino>
		<identificador>77524</identificador>
	</vehiculo>
	<vehiculo>
		<destinatario>Akeem Key</destinatario>
		<modelo>Hyundai Motors</modelo>
		<email>vel@yahoo.us</email>
		<destino>Poland</destino>
		<identificador>70889</identificador>
	</vehiculo>
	<vehiculo>
		<destinatario>Samson Jones</destinatario>
		<modelo>Fiat</modelo>
		<email>nunc.commodo@hotmail.com</email>
		<destino>Italy</destino>
		<identificador>31998</identificador>
	</vehiculo>
	<vehiculo>
		<destinatario>Lenore Conner</destinatario>
		<modelo>Renault</modelo>
		<email>cras.dolor.dolor@outlook.us</email>
		<destino>Sweden</destino>
		<identificador>53174</identificador>
	</vehiculo>
	<vehiculo>
		<destinatario>Olga Walter</destinatario>
		<modelo>Nissan</modelo>
		<email>orci.donec@outlook.es</email>
		<destino>Sweden</destino>
		<identificador>55604</identificador>
	</vehiculo>
	<vehiculo>
		<destinatario>Anika Short</destinatario>
		<modelo>Ferrari</modelo>
		<email>nam@yahoo.us</email>
		<destino>China</destino>
		<identificador>4959</identificador>
	</vehiculo>
	<vehiculo>
		<destinatario>Chiquita Herman</destinatario>
		<modelo>Seat</modelo>
		<email>in.lorem.donec@protonmail.us</email>
		<destino>China</destino>
		<identificador>73529</identificador>
	</vehiculo>
	<vehiculo>
		<destinatario>Ella Wagner</destinatario>
		<modelo>Chevrolet</modelo>
		<email>molestie.sed@protonmail.us</email>
		<destino>Spain</destino>
		<identificador>74677</identificador>
	</vehiculo>
	<vehiculo>
		<destinatario>Phyllis Hoffman</destinatario>
		<modelo>Suzuki</modelo>
		<email>scelerisque.lorem@gmail.us</email>
		<destino>Vietnam</destino>
		<identificador>85890</identificador>
	</vehiculo>
	<vehiculo>
		<destinatario>Isadora Douglas</destinatario>
		<modelo>Maruti Suzuki</modelo>
		<email>amet.orci@gmail.com</email>
		<destino>Spain</destino>
		<identificador>58656</identificador>
	</vehiculo>
	<vehiculo>
		<destinatario>Christen Hammond</destinatario>
		<modelo>Seat</modelo>
		<email>cum.sociis@hotmail.us</email>
		<destino>Poland</destino>
		<identificador>96949</identificador>
	</vehiculo>
	<vehiculo>
		<destinatario>Ali Hunter</destinatario>
		<modelo>Mitsubishi Motors</modelo>
		<email>massa.quisque.porttitor@outlook.com</email>
		<destino>South Korea</destino>
		<identificador>79284</identificador>
	</vehiculo>
	<vehiculo>
		<destinatario>Ferdinand Landry</destinatario>
		<modelo>Kia Motors</modelo>
		<email>eleifend.vitae.erat@hotmail.es</email>
		<destino>Norway</destino>
		<identificador>32014</identificador>
	</vehiculo>
	<vehiculo>
		<destinatario>Vladimir Mueller</destinatario>
		<modelo>Porsche</modelo>
		<email>mauris@hotmail.com</email>
		<destino>Norway</destino>
		<identificador>21890</identificador>
	</vehiculo>
	<vehiculo>
		<destinatario>Grady Franks</destinatario>
		<modelo>MINI</modelo>
		<email>orci.luctus.et@protonmail.com</email>
		<destino>Brazil</destino>
		<identificador>43348</identificador>
	</vehiculo>
	<vehiculo>
		<destinatario>Octavia Salinas</destinatario>
		<modelo>Nissan</modelo>
		<email>enim.nisl@protonmail.us</email>
		<destino>Peru</destino>
		<identificador>46812</identificador>
	</vehiculo>
	<vehiculo>
		<destinatario>Harding Powell</destinatario>
		<modelo>Honda</modelo>
		<email>feugiat.lorem@outlook.com</email>
		<destino>Indonesia</destino>
		<identificador>59896</identificador>
	</vehiculo>
	<vehiculo>
		<destinatario>Justina Mckenzie</destinatario>
		<modelo>Kia Motors</modelo>
		<email>nec.quam.curabitur@yahoo.com</email>
		<destino>Canada</destino>
		<identificador>68358</identificador>
	</vehiculo>
	<vehiculo>
		<destinatario>Ann Tate</destinatario>
		<modelo>Maruti Suzuki</modelo>
		<email>neque.pellentesque@hotmail.es</email>
		<destino>Russian Federation</destino>
		<identificador>3591</identificador>
	</vehiculo>
	<vehiculo>
		<destinatario>Lavinia Dorsey</destinatario>
		<modelo>Infiniti</modelo>
		<email>ac.turpis@yahoo.us</email>
		<destino>New Zealand</destino>
		<identificador>25793</identificador>
	</vehiculo>
	<vehiculo>
		<destinatario>Maris Jackson</destinatario>
		<modelo>Fiat</modelo>
		<email>nec.cursus.a@protonmail.es</email>
		<destino>Mexico</destino>
		<identificador>93495</identificador>
	</vehiculo>
	<vehiculo>
		<destinatario>Megan Fulton</destinatario>
		<modelo>Suzuki</modelo>
		<email>ipsum.non@hotmail.com</email>
		<destino>Sweden</destino>
		<identificador>14155</identificador>
	</vehiculo>
	<vehiculo>
		<destinatario>Benjamin Acevedo</destinatario>
		<modelo>Lexus</modelo>
		<email>cras.dictum.ultricies@yahoo.es</email>
		<destino>Mexico</destino>
		<identificador>52171</identificador>
	</vehiculo>
	<vehiculo>
		<destinatario>Jonas Fuller</destinatario>
		<modelo>Honda</modelo>
		<email>orci.sem@hotmail.com</email>